Unnamed: 0,author_id,rating,is_recommended,helpfulness,total_feedback_count,total_neg_feedback_count,total_pos_feedback_count,submission_time,review_text,review_title,skin_tone,eye_color,skin_type,hair_color,product_id,product_name,brand_name,price_usd
0,2190293206,2,0.0,,0,0,0,2023-03-19,"Used to swear by this product but hate the smell of the reformulation.  Love the price, but willing to spend more for a product that doesn’t smell gross",,lightMedium,brown,combination,brown,P443842,Retinol Anti-Aging Serum,The INKEY List,12.99
1,9113341005,5,1.0,,0,0,0,2023-03-18,I’ve only been using this for a week and my skin is so much softer. It’s not as “harsh” on my skin as The Ordinary’s retinol- it took some getting used to but not this one. I’m not purging and my skin isn’t drying,More tolerable than The Ordinary,deep,brown,normal,black,P443842,Retinol Anti-Aging Serum,The INKEY List,12.99
2,23866342710,1,0.0,1.0,13,0,13,2023-03-12,"Why, why, why would you change the formula?!!! I have been using this for year. It was truly amazing. Constantly getting compliments on my skin. I am 40 years old and it was perfect. I opened my new bottle and thought I got a bad one. It was rancid. Ordered a second bottle and the same. I am so upset. Why would they change it.",New formula is awful very sad,fairLight,blue,combination,blonde,P443842,Retinol Anti-Aging Serum,The INKEY List,12.99
3,1328806527,1,0.0,0.9411759972572328,17,1,16,2023-03-12,"I have used this product for years and it has been nothing short of awesome. Honestly, I am 44 and people think I am in my early 30s because of what this does for my skin. Hardly a wrinkle in sight. However, the latest package I bought in Feb 2023 contained serum that smelled rancid. Like spoiled milk. I tried it anyway and it felt thick and awful on my skin. I returned it to Sephora and learned that Inkey List REFORMULATED this product. I am SO upset. I really hope Inkey goes back to the old formulation because the new one is garbage.",Recently reformulated and the new formula is AWFUL,light,brown,combination,gray,P443842,Retinol Anti-Aging Serum,The INKEY List,12.99
4,31262847082,5,1.0,1.0,1,0,1,2023-03-09,Great product for anti-aging Also great for dark spots,Must have product in my nighttime skincare routine,lightMedium,hazel,combination,brown,P443842,Retinol Anti-Aging Serum,The INKEY List,12.99
5,38092205147,4,1.0,1.0,5,0,5,2023-03-06,"I’ve been using this product twice a week and I’ve seen results. My skin is smothered, my pores look better and it feels healthy. You get what you pay for!",,,,,,P443842,Retinol Anti-Aging Serum,The INKEY List,12.99
6,5090375964,4,1.0,1.0,1,0,1,2023-03-05,Decent serum ; it didn’t cause any breakouts while using at nighttime.Just a bit heavy on my complexion.,Great size,,brown,combination,black,P443842,Retinol Anti-Aging Serum,The INKEY List,12.99
7,42425576020,5,1.0,1.0,2,0,2,2023-03-05,"I recently bought this about less than 4 days ago, I’m not sure if there was a bad batch or what but mine does not smell of whatever everyone else is talking about. There is no smell to mine?",No smell for me!,fairLight,gray,combination,blonde,P443842,Retinol Anti-Aging Serum,The INKEY List,12.99
8,6768361454,1,0.0,0.9090909957885742,11,1,10,2023-03-03,"Been using this product for well over a year and loved it. Recently restocked and thought I bought the wrong thing because it smells HORRIBLE, I can’t push through it. Idk why they would change the formula but sad I have to find a new one",,light,hazel,combination,brown,P443842,Retinol Anti-Aging Serum,The INKEY List,12.99
9,6860968769,1,0.0,0.800000011920929,15,3,12,2023-03-01,"I used to swear by this product, but after the last purchase I made I will not be restocking this ever again.  I literally thought I received something rotting inside as soon as I opened it. Shocked, I returned to the store get a new one only to open it in-store and discover the new formulation just smells like this. I literally threw up in my mouth. Save yourselves. new",Threw up in my mouth - new formulation SUCKS,lightMedium,blue,dry,brown,P443842,Retinol Anti-Aging Serum,The INKEY List,12.99
10,23687096886,5,1.0,0.6666669845581055,3,1,2,2023-03-01,"I have tried SO many retinols, and while I typically need retinol for acne, this one manages to get rid of my wrinkles AND my acne. I have tried a new retinol twice since I found this one and I immediately go back every time. My skin drinks it like water, and the glow is unmatched. My only complaint is that I wish they sold a larger size!",My skin can't get enough of this stuff.,porcelain,blue,dry,brunette,P443842,Retinol Anti-Aging Serum,The INKEY List,12.99
11,37268946149,2,0.0,0.857142984867096,7,1,6,2023-02-27,Smells so bad. I tried pushing through the bad smell for a few uses but it’s really unbearable. Going to return :( I usually love Inkey List though,Smelly,light,blue,combination,blonde,P443842,Retinol Anti-Aging Serum,The INKEY List,12.99
12,8751720702,4,1.0,1.0,1,0,1,2023-02-24,"Very light watery serum so you can easily apply other products once it’s dry. For the price, I haven’t used anything like it",Nice product!,fair,brown,dry,brown,P443842,Retinol Anti-Aging Serum,The INKEY List,12.99
13,5683470893,1,0.0,1.0,7,0,7,2023-02-24,"This a a wall of text but I genuinely have to put this out there.I LOVED this product and purchased it religiously for several years. It was my favorite serum. But recently they have changed the formula, and now it is, for me, completely unusable. I’m going to preface this by saying that once I found a good skincare routine, I stuck with it. I never changed ANYTHING, I just bought more of what I’d been using when I ran low.With the old formula, I had absolutely zero irritation and my skin was breakout free. It didn’t feel overly-sensitive, and the texture was nice. When I ran out of my last tube of the old formula, I bought a new one and you could immediately tell it was different. The consistency was sticky and sort of greasy, the color was off, and the scent was almost rancid. It used to smell sort of like maple syrup, and it used to feel really pleasant to apply in terms of consistency and a nice, warming sensation. The old formula soaked in quickly and didn’t leave a weird film on my skin. The new formula gave me a stinging, burning sensation on application, never completely absorbed and left my skin feeling sticky. By morning (I applied it before bed), my skin was super greasy, which never happened before. It was also red and splotchy, and felt irritated.After about week of hoping maybe it was something else - like I said, I loved this serum before - I started having breakouts all over my face and neck, which I had also not had an issue with before. I also had a constant itchy, burning feeling on my neck. Stopped using it and switched to another retinol (which was unfortunately not the reasonable price point of INKey) and my skin went back to normal. It’s legitimately no longer a good product. I would not even say your mileage may vary - I would not feel comfortable recommending this to anyone.",New formula has ruined my favorite serum,light,hazel,combination,,P443842,Retinol Anti-Aging Serum,The INKEY List,12.99
14,23851455908,2,0.0,0.6000000238418579,5,2,3,2023-02-20,"I LOVE the inkey list, but this product simply does not work. If it helps with anti-aging and post inflammatory hyperpigmentation, it wasn’t noticeable. It certainly doesn’t help with acne. Over time I noticed more breakouts happening. So I switched back to Differin, which had always been my go-to retinol. Now my skin is purging pretty badly after the switch. Sorry inkey list, love you, but this missed the mark.",Doesn't Work,,blue,oily,auburn,P443842,Retinol Anti-Aging Serum,The INKEY List,12.99
15,46387080651,4,1.0,0.6666669845581055,3,1,2,2023-02-15,"I enjoy the product itself, the smell doesn’t bother me so much. But I hate the packaging. The packaging is horrible and makes me want to look for a new retinol. But I enjoy that actual retinol product.",Like the product. Hate the packaging,fairLight,brown,oily,red,P443842,Retinol Anti-Aging Serum,The INKEY List,12.99
16,27639389172,1,0.0,0.625,8,3,5,2023-02-15,Smells awful. Could not bear putting on the face. Consistency is drippy like a serum.,Sour smell is off putting,fair,brown,normal,,P443842,Retinol Anti-Aging Serum,The INKEY List,12.99
17,6442783656,4,1.0,0.800000011920929,5,1,4,2023-02-13,"Wish they made a larger size and a pump dispenser. Every time I use it there’s a bit of serum collected on the lid and it’s impossible to get out, so when I close the container back up, it just gushes out and makes a mess. A","Love this serum, hate the dispenser.",lightMedium,green,normal,brown,P443842,Retinol Anti-Aging Serum,The INKEY List,12.99
18,7778640948,1,0.0,1.0,5,0,5,2023-02-13,"I’ve been using this for an year, and the recent formula smells horrible. I think I’ll end up returning this",Not same as the old one,,brown,dry,black,P443842,Retinol Anti-Aging Serum,The INKEY List,12.99
19,33705816419,5,1.0,1.0,2,0,2,2023-02-13,I’m crazy about this product. I love it. That’s my second tube❤️❤️,Must have product,fair,brown,dry,brown,P443842,Retinol Anti-Aging Serum,The INKEY List,12.99
20,8228421510,1,0.0,0.8888890147209167,9,1,8,2023-02-10,"The smell in the new formula grosses me out to the point where I hate putting it on. The previous formula was working out great for me, this one is making me breakout. Hope they bring old one back :(",Smells horrible,medium,brown,combination,black,P443842,Retinol Anti-Aging Serum,The INKEY List,12.99
21,20440005187,2,0.0,1.0,6,0,6,2023-02-09,"I wish I saw all the recent reviews about the new formula before I purchased… It smells awful!! Like vinegar and dirty socks. Can’t attest to the effectiveness yet, but the scent is enough to deter me from ever repurchasing.",SMELLS BAD,,brown,combination,black,P443842,Retinol Anti-Aging Serum,The INKEY List,12.99
22,27122684339,1,0.0,1.0,11,0,11,2023-02-08,PLEASE bring back the old formula. This new one smells really bad and disappointing.,,light,,combination,,P443842,Retinol Anti-Aging Serum,The INKEY List,12.99
23,21582452079,1,0.0,1.0,2,0,2,2023-02-06,"This was awful for me - clearly I’m in the minority, but my skin hated this. I don’t have especially sensitive skin - I’ve used a lot of different retinols, from beginner level to heavier duty, but this is the only one that gave me an immediate allergic reaction - my skin broke out in hives, and was burning within a minute of putting this on. This was not a normal “stinging because it’s working“ kind of reaction, but “something is wrong“ kind of reaction - I immediately washed this off, and my skin was bright red and irritated the rest of the night. Clearly it works for some people, but not me - if you’re looking for a beginner retinol, I’d recommend looking elsewhere.",,,green,normal,black,P443842,Retinol Anti-Aging Serum,The INKEY List,12.99
24,5117068738,5,1.0,1.0,4,0,4,2023-02-06,"Holy guacamole....I bought this about a month ago and held off on using it because I wasn’t sure what to expect. I’ve recently been struggling with dry, cold Montana air and sporadic cystic pimples and random texture/bumps on my cheeks. I was getting desperate and I started it a week ago and it’s completely erased texture, brightened my pimple scarring and boosted my glow and skin’s evenness. I use a pea size amount all over my face every other night, put the Dr Jart cream on top, wait a few hours and then put a tiny bit more of D Jart and Aquaphor on to combat dryness. My skin looks nearly flawless. No pimples, no flaking or texture. It has a slightly odd smell (not like rancid milk as others say) that only lasts for a few seconds. And this is only $12! Inkey List, PLEASE never stop making this.",Miracle serum!,light,hazel,normal,,P443842,Retinol Anti-Aging Serum,The INKEY List,12.99
25,24595435489,4,1.0,1.0,4,0,4,2023-02-06,"I’ve bought this twice before and have loved it (it’s been helping to keep my fine lines to a minimum!), and bought a third one last month to replenish. Four rather than five stars because they seem to have changed the formula -- the scent went from inoffensive to smelling like Elmer’s glue, and it also now stings my skin and has left it much drier and more sensitive. Will try switching to using it only once every few nights and hope my skin readjusts.",new formula?,fair,brown,combination,,P443842,Retinol Anti-Aging Serum,The INKEY List,12.99
26,24111448404,2,0.0,,0,0,0,2023-02-05,Dries my skin out to the point where it’s flaking and makes me breakout,Not for me,fairLight,blue,dry,brown,P443842,Retinol Anti-Aging Serum,The INKEY List,12.99
27,1480662380,5,1.0,,0,0,0,2023-02-05,This product is amazing! Did not disappoint. This was my first time buying it and it has helped my skin.,A must have in my routine!,fairLight,brown,combination,brown,P443842,Retinol Anti-Aging Serum,The INKEY List,12.99
28,22101370988,1,0.0,1.0,1,0,1,2023-02-04,This is a gentle retinol option but did not do anything for my skin,,light,hazel,combination,blonde,P443842,Retinol Anti-Aging Serum,The INKEY List,12.99
29,35432472438,5,1.0,,0,0,0,2023-02-01,I love this product 💖💖 this is my third tube👍🏻👍🏻this is must have product,Must have product. Love it,light,brown,combination,brown,P443842,Retinol Anti-Aging Serum,The INKEY List,12.99
30,27147241873,5,1.0,0.9411759972572328,17,1,16,2023-01-25,Let me note I did not have a skincare regime & decided to buy the inkey line & started slowly & got better at skincare as I went along getting less lazy each month.  It was like a 6-month process so I judged each product for a month at a time.  First started cleansing 2-3x a day.   Then morning sunscreen & nightime moisturizers.  Then added serums & eye serums under that.  Finally retinol last.  This product does complete cell turnover overnight.  You’ll wake up & go wow.  My skin is glowing.  After a week (used every other day) you’ll go oh my complexion has lightened & is evening out.  After a month all the little micro freckles & super old acne scars are gone & your skin is completely even.  My mom at the end of the month said my makeup looked good today.  Wasn’t wearing any! People at work said I had dewy skin.  I am 40 now & mentally went from the traumatized pizza-faced pimpled teenager to “dewy.”  That spoke volumes for me; this product rocks my socks.  Make sure to combo the next day with sunscreen as retinol makes you vulnerable to sun damage.,This is the only thing in my life I will vouch for,,brown,combination,auburn,P443842,Retinol Anti-Aging Serum,The INKEY List,12.99
31,9564020784,4,1.0,0.8888890147209167,9,1,8,2023-01-23,"I wanted to give this one a shot because the ordinary brand one just sat on my skin and felt so heavy on my face. This one is leaps and bounds better in terms of not just creating a layer of oil on my face. It seems to be working pretty well so far the only negative I have is the smell. It smell awful I can’t even describe the smell it’s not chemically or synthetic fragrance or anything like that it’s more like old sweaty socks. Luckily the scent doesn’t linger too long, after about twenty minutes I can’t smell it any longer but it’s enough of a negative to deduct one star.",Horrible smell but doesn't linger,,hazel,combination,,P443842,Retinol Anti-Aging Serum,The INKEY List,12.99
32,5247674283,5,1.0,0.5,4,2,2,2023-01-22,"This is my first retinol product that I’ve used consistently, especially since I’m in my late 20s now. I apply this to my whole face but wanted to this help with fine lines on my forehead. It’s a small bottle but a little is all you need!",,light,brown,combination,,P443842,Retinol Anti-Aging Serum,The INKEY List,12.99
33,27460530170,5,1.0,0.0,14,14,0,2023-01-21,"LOVE. LOVE. LOVE.melts my makeup off, doesn’t leave an oily residue, and hasn’t broken me out.",a steal,fair,green,combination,blonde,P443842,Retinol Anti-Aging Serum,The INKEY List,12.99
34,10841175119,5,1.0,1.0,1,0,1,2023-01-19,Lo amé!! estoy usandolo todas las noches y me ha ayudado a mejorar mi piel en todos los sentidos!,,,brown,oily,black,P443842,Retinol Anti-Aging Serum,The INKEY List,12.99
35,35565731108,5,1.0,,0,0,0,2023-01-18,This is such a good bang for your buck. Makes a difference in texture and firmness without being expensive. Such a practical item.,A Practical Retinol,,blue,dry,,P443842,Retinol Anti-Aging Serum,The INKEY List,12.99
36,8943777906,4,0.0,0.5,8,4,4,2023-01-18,"I don’t have much wrinkles since I’m young so im not sure how effect it is on that But I think this helps with breakouts. The thing is it dries down in one second and you have to apply is super fast. Also the smell is so bad, it’s almost unbearable. I have to hold my breath to apply this stuff.",SMELLS SO BAD but works okay.,light,brown,combination,black,P443842,Retinol Anti-Aging Serum,The INKEY List,12.99
37,41242546553,2,0.0,0.3333329856395721,3,2,1,2023-01-15,smells like sourdough bread in the worst way. good price tho. wouldn’t recommend.,smells bad,,,,,P443842,Retinol Anti-Aging Serum,The INKEY List,12.99
38,44428715220,2,1.0,0.6666669845581055,6,2,4,2023-01-15,"Lowkey smells like birthday cake. I’m not into fragranced products and this one, while food for my skin, is hard to use every night because the smell is so strong",,,,,,P443842,Retinol Anti-Aging Serum,The INKEY List,12.99
39,2667539492,1,0.0,0.5714290142059326,7,3,4,2023-01-13,I really wanted to love this product but I couldn’t use it more than twice because it smells disgusting. It literally smelled like I was putting rancid milk curds on my face. Do not recommend.,Smells like spoilt milk…disgusting!,,,,,P443842,Retinol Anti-Aging Serum,The INKEY List,12.99
40,44557311050,5,1.0,0.800000011920929,5,1,4,2023-01-08,"I like this product, my skin resist strong retinols. I use it for my acne scars and to make my skin look better like uneven skin tone, texture, and kind of hydration. It also helps with my little fine lines that I have in my eyes and around my mouth.",A great product to add to your routine,light,brown,combination,red,P443842,Retinol Anti-Aging Serum,The INKEY List,12.99
41,27749504625,4,1.0,1.0,3,0,3,2023-01-06,"I have been using this retinol for the so famous skin cycling and so far so good.I repurchased this many times and would keep using it, good for beginners.",,,brown,dry,black,P443842,Retinol Anti-Aging Serum,The INKEY List,12.99
42,11487583197,3,1.0,0.75,4,1,3,2023-01-05,"This was an okay retinol. I will say the texture of this retinol was perfect for my oily skin, but it really didn’t do more than smooth out my skin’s texture. It did nothing for my fine lines, PIH, or anything else really.","Good for first time users but overall, just okay",tan,brown,oily,black,P443842,Retinol Anti-Aging Serum,The INKEY List,12.99
43,9634014167,5,1.0,0.0769231021404266,26,24,2,2022-12-31,love the matte finish on this primer! feels so soft !,PORES BE GONE,,brown,combination,blonde,P443842,Retinol Anti-Aging Serum,The INKEY List,12.99
44,43722995460,5,1.0,0.5,12,6,6,2022-12-16,"I absolutely adore it! Its a game changer, my routine been much better since I got this BUT if you have sensitive skin as me I would recommend only to use twice a week or else you will feel a sense of burn on your face (on my experience)",,light,brown,dry,,P443842,Retinol Anti-Aging Serum,The INKEY List,12.99
45,1346143363,1,0.0,0.7058820128440857,17,5,12,2022-12-09,Smells horrible. Possibly rancid?.............................,Unbearable Smell,,brown,combination,,P443842,Retinol Anti-Aging Serum,The INKEY List,12.99
46,2800854217,3,1.0,0.7777780294418335,27,6,21,2022-12-03,"I have been using this retinol for about a year now and I love it. However, recently they changed the formula and now it went from smelling like maple syrup to a powder baby diaper gross smell. Please go back to the maple syrup scent!",Changed formula now smells bad,fair,blue,combination,blonde,P443842,Retinol Anti-Aging Serum,The INKEY List,12.99
47,21407018770,5,1.0,0.800000011920929,5,1,4,2022-12-02,I’ve noticed improvement with my skin texture and bounce back/recovery time from my acne since I’ve started using this. It’s a huge staple in my skin care routine now.,Pleasantly Surprised,light,green,oily,blonde,P443842,Retinol Anti-Aging Serum,The INKEY List,12.99
48,8278810228,5,1.0,0.800000011920929,10,2,8,2022-11-30,"I’m new to retinol products and I’m in love with this so far! I’m 30, have moderate texture and fine lines. I’ve used this once a week for two weeks now and can already see a big difference in texture. I use the sandwich method of applying the serum in between layers of moisturizer, and put a layer of Vaseline as a last step to lock in moisture. I feel like this method will keep away irritation or flakiness as my skin gets use to retinol. For the price, you can’t beat this serum!",It’s Awesome!,fair,green,dry,blonde,P443842,Retinol Anti-Aging Serum,The INKEY List,12.99
49,5698627875,4,1.0,0.9166669845581056,12,1,11,2022-11-29,"I know the name says anti-aging but retinol was connected to acne initially so I decided to give it a shot as someone who has had hormonal acne for over 5 years. Most topical products will not get rid of your acne, especially for me when it is the hormones controlling what pops up but I have enjoyed this a lot for overall smoothness and evenness of my skin. I purchased this in April 2022 and used it everyday for 2 weeks, I thought the percentage in here must be low and I’ve been using strong products for years but I definitely could not use this daily. By the 3rd week, my skin felt raw and there were bumps to show the irritation of using this daily so from April until November I used this 2-3 time weekly skipping days and that worked for me. This lasted super long and I am overall happy with the results. It helped the most with toning down acne irritation and really decreasing the size and redness of the pimples that come out here and there. I also haven’t seen one single blackhead on my nose since April so it definitely works. I’m in my late 20s so I don’t have extremely pronounced wrinkles, but I did use this on my neck and around my eyes and it didn’t help with those wrinkles so not sure how drastic the age effects really are.",Great product,,brown,combination,,P443842,Retinol Anti-Aging Serum,The INKEY List,12.99
50,34062382043,4,1.0,0.7777780294418335,9,2,7,2022-11-18,"Really like this product! I would make sure to pair it with an SPF and only use a few times a week. I noticed more breakouts when I used this product more then 2 or 3 times a week, but when I use it every few nights and follow with a good moisturizer, this product works amazingly and has worked wonders on my overall skin texture. If buying, I would just make sure to take extra steps to protect your skin barrier.",,light,brown,combination,,P443842,Retinol Anti-Aging Serum,The INKEY List,12.99
51,27109249998,5,1.0,0.8333330154418945,6,1,5,2022-11-14,I recently started using Retinol and I love how this feels ok on my skin. I have very sensitive skin and this doesn’t irritate me at all.,Very soft on the skin,lightMedium,,combination,,P443842,Retinol Anti-Aging Serum,The INKEY List,12.99
52,26806219826,5,1.0,0.846153974533081,13,2,11,2022-11-10,"O love this product, I don’t have so many spots on my face, but the few I have I could see the change, it has a better texture, less dry. It can be a little aggressive on the first day, I recommend using a small amount and not applying to the eye contour! But the truth is that I love this product and I recommend it 100%🫶🏻😍",,light,brown,combination,,P443842,Retinol Anti-Aging Serum,The INKEY List,12.99
53,1212940220,5,1.0,0.6666669845581055,9,3,6,2022-11-04,I love that this product is so hydrating and goes on seamlessly. I use it at night after washing my face and after using hyaluronic acid. I love the yellow tint in the product.. makes my face glow at night!,A must have in my night routine,medium,brown,normal,black,P443842,Retinol Anti-Aging Serum,The INKEY List,12.99
54,21582452079,1,0.0,1.0,1,0,1,2022-09-30,"I’m writing this because of the overwhelmingly positive reviews, but I had an allergic reaction to this. I’ve tried several other retinols and haven’t had issues, including tretinoin for a time, but this one instantly gave me itchy hives. Too bad since the price is so good and it clearly works for many people!",Allergic Reaction,fairLight,green,normal,black,P443842,Retinol Anti-Aging Serum,The INKEY List,12.99
55,5937804412,5,1.0,0.7826089859008789,23,5,18,2022-09-24,I’ve used this since it came out and it works extremely well for sensitive skin. I occasionally use the much stronger Skinceuticals 1.0 retinol and it is so hard on my skin that I usually end up going back to this one. Definitely a favorite,Great retinol for sensitive skin!,fair,hazel,combination,brown,P443842,Retinol Anti-Aging Serum,The INKEY List,12.99
56,1379741419,5,1.0,0.8333330154418945,6,1,5,2022-09-23,I love this product. The price is  very reasonable,Good product,mediumTan,brown,combination,brown,P443842,Retinol Anti-Aging Serum,The INKEY List,12.99
