Unnamed: 0,author_id,rating,is_recommended,helpfulness,total_feedback_count,total_neg_feedback_count,total_pos_feedback_count,submission_time,review_text,review_title,skin_tone,eye_color,skin_type,hair_color,product_id,product_name,brand_name,price_usd
553,5817048783,4,1.0,1.0,1,0,1,2020-03-01,"Great and clean product, easy to use that smoothes the skin. Will update my review after long term use.",,fair,green,combination,blonde,P443842,Retinol Anti-Aging Serum,The INKEY List,12.99
554,24930147751,4,1.0,1.0,1,0,1,2020-03-01,This is a very good product I can’t stop using it my face looks so good I use it with my serum and Aveeno lotion they work great to getter,,mediumTan,brown,combination,black,P443842,Retinol Anti-Aging Serum,The INKEY List,12.99
555,23825513167,4,1.0,1.0,1,0,1,2020-02-29,"Took a little time for my skin to adjust to this Retinol, but after a week it was fine. I cant say that I have noticed any difference on my face, but I’ll give it a bit longer.",,fair,hazel,normal,blonde,P443842,Retinol Anti-Aging Serum,The INKEY List,12.99
556,7631479424,5,1.0,0.7894740104675293,19,4,15,2020-02-29,"I was lucky enough to be chosen by PinchMe to test out the Inkey Retinol Anti Aging Serum. I’m in my late 30’s. My skincare has been a major priority for me for a while now. I’ve tried many different types and brands of face and eye serums, Inkey is by far my absolute favorite. It goes on smooth, easily, I enjoy a little tingle let’s me know it’s doing its job. I’ve noticed some difference so far, I’ve also ordered more of their Retinol as well as the Caffeine eye cream and the Hyaluronic Acid Hydrating cream. I love all the products so far, I’m beyond obsessed I’d love to try Inkey’s whole line. It’s very affordable, does what it claims. I’ve tried $130 jars of eye serum/creams and have had better results with Inkey. The bags under my eyes look better, I can see it helping my eyes look brighter, and haven’t noticed any new or more fine lines or wrinkles. This is my favorite product right now and I’ve recommended to everyone I know! Can’t wait to try the rest of the line!",Inkey List Retinol Serum!!!,fair,hazel,oily,blonde,P443842,Retinol Anti-Aging Serum,The INKEY List,12.99
557,25347966070,5,1.0,0.0,1,1,0,2020-02-29,Was super excited to try this as soon as I received it! Left my my face felt great!! Super soft and not greasy at all!,Amazing!,light,green,dry,blonde,P443842,Retinol Anti-Aging Serum,The INKEY List,12.99
558,5221340193,5,1.0,0.6666669845581055,3,1,2,2020-02-28,Great product at a great price. This serum is super lightweight and drinks beautifully into the skin. My face felt tight and smoother after every application.,Great product,lightMedium,brown,combination,brown,P443842,Retinol Anti-Aging Serum,The INKEY List,12.99
559,6938159913,4,1.0,1.0,1,0,1,2020-02-28,"Overall impressed with this product for the price. I would probably prefer and higher concentrate of retinol, but this is really good for when you’re starting off getting your skin used to retinol. The smell is mild in my opinion, other retinol products have a much more pungent smell. I would buy again and would recommend to friends looking to get into a skin care routine.",Pleased with the value,fair,blue,normal,blonde,P443842,Retinol Anti-Aging Serum,The INKEY List,12.99
560,25343434513,5,1.0,1.0,1,0,1,2020-02-28,"I love how it leaves my skin feeling, it feels like a light marshmallow when you first apply it, then blends right in and has no feel. Doesn’t make me feel weighed down or sticky feeling. It says to use every other night to begin this was my first experience with retinol so I did that the first two times I used it. I had no irritation at all so I started using every night still no irritation, I could honestly see a difference in my skin after the first couple of uses, my skin was brighter and smoother. I love the transformation in my skin! Lines and wrinkles are less noticeable, smoother, brighter more even skin tone and some small scars I had are all but gone. I can’t wait to see the results in a couple of months! I would say to just keep skin hydrated you will love this product too especially if you’ve never used retinol before, gentle enough but strong enough to give noticeable results.",,lightMedium,brown,oily,brown,P443842,Retinol Anti-Aging Serum,The INKEY List,12.99
561,1342413184,5,1.0,,0,0,0,2020-02-28,"Very Pleasantly Surprised by this product! The texture is light and absorbs quickly and I found it to be completely non-irritating. I love that quality, affordable products with potent actives are available at Sephora these days- I can’t wait to try more from Inkey List. I’ve been using consistantly for a few weeks now and definitely see improvement in the smoothness of my skin.",,light,blue,normal,blonde,P443842,Retinol Anti-Aging Serum,The INKEY List,12.99
562,1580531556,2,0.0,0.6666669845581055,3,1,2,2020-02-28,"I had high hopes for this, but I was not a big fan of this retinol. I didn’t like the texture of the serum, it was much thicker than serum I use normally. The smell was a bit funky, didn’t sit well with me. I don’t feel this soaked into my skin, it just sat on top and didn’t do much. I would not recommend buying.",,light,blue,combination,blonde,P443842,Retinol Anti-Aging Serum,The INKEY List,12.99
563,1166592124,5,1.0,1.0,2,0,2,2020-02-28,This  is a great product at a fantastic affordable price! I use it nightly and have noticed smoother skin ! I would reccomend this product !,,lightMedium,blue,normal,blonde,P443842,Retinol Anti-Aging Serum,The INKEY List,12.99
564,1613597183,4,1.0,0.5,2,1,1,2020-02-27,This serum goes on smooth. Will continue using to see the long term results.,Waiting to see progress,tan,brown,combination,brown,P443842,Retinol Anti-Aging Serum,The INKEY List,12.99
565,5501713874,5,1.0,1.0,1,0,1,2020-02-27,"I started using the Inkey List Retinol Anti-aging serum for a few weeks as part of my nighttime skin care routine. My face feel super smooth in the morning.  This has been my first experience with a retinol, and I like how the Inkey List is super affordable but still shows results. I would definitely recommend using a good moisturizer on top because my skin felt a little dry after a few days of use.",Affordable and effective,light,blue,combination,blonde,P443842,Retinol Anti-Aging Serum,The INKEY List,12.99
566,5436594474,5,1.0,1.0,1,0,1,2020-02-27,Outstanding product for the price! Normally I’m a bit skeptical when it comes to skincare products that a at a lower price point than brands I’m used to but I Inkey’s retinol serum works just as well as some higher priced ones. The serum felt like on my skin and seemed to give it an immediate boost. I definitely want to try the rest of Inkey’s line of products now.,Outstanding serum for the price!,mediumTan,brown,combination,brown,P443842,Retinol Anti-Aging Serum,The INKEY List,12.99
567,20566383995,5,1.0,,0,0,0,2020-02-27,I have been using this serum as part of my nightly beauty routine and really like it so far. It goes on smoothly and keeps my skin soft without drying me out. Highly recommend this product!,Great serum!,fairLight,brown,combination,brown,P443842,Retinol Anti-Aging Serum,The INKEY List,12.99
568,1536673242,4,1.0,,0,0,0,2020-02-27,"I’ve used this product for a few weeks now, every other night. I see some improvement in my post acne scars and some overall complexion brightening. But it also made my skin very very dry. It works, but be ready to glob on the moisturizer, especially in the first two weeks. For the price I think it’s great. This was the first retinol I’ve used.",,fair,brown,combination,brown,P443842,Retinol Anti-Aging Serum,The INKEY List,12.99
569,1473564754,5,1.0,1.0,1,0,1,2020-02-27,"I have been using The Inkey List Retinol Anti-aging serum for several weeks and my skin feels so good! I use a little bit under my regular moisturizer and even when I wake up I still have this amazing calmness to my skin. I never have greasy residue! I also love the fact that with this product a little does go a long way! Also, I noticed there is no harsh chemical smells like other retinol serums can have. I really enjoyed my experience with The Inkey List!","Felt good in the evening, lasting til morning!",light,blue,oily,red,P443842,Retinol Anti-Aging Serum,The INKEY List,12.99
570,6752788827,5,1.0,,0,0,0,2020-02-27,Love this brand. My skin feels better than ever. Looks and feels amazing! Must have!!,,lightMedium,hazel,normal,brown,P443842,Retinol Anti-Aging Serum,The INKEY List,12.99
571,5271309125,5,1.0,1.0,1,0,1,2020-02-27,I’ve been using this product for a month now. My skin looks and feels amazing I have dark spots that or staying to discolor.,,light,green,combination,brown,P443842,Retinol Anti-Aging Serum,The INKEY List,12.99
572,23045417613,5,1.0,,0,0,0,2020-02-27,"Absolutely love this product! Used daily, and the difference in my skin is unbelievable.   After my sample is done I will be going to Sephora to purchase more!",The best I ever used.  I used alot of products on,lightMedium,green,combination,brown,P443842,Retinol Anti-Aging Serum,The INKEY List,12.99
573,1171660650,4,1.0,,0,0,0,2020-02-27,"This product is inexpensive, and it works in minimizing wrinkles and pores. I would recommend this product.",,light,hazel,combination,brown,P443842,Retinol Anti-Aging Serum,The INKEY List,12.99
574,21916181153,5,1.0,0.5,4,2,2,2020-02-27,excellent retinol cream. didn’t bother my skin at all,great price great product,medium,hazel,normal,brown,P443842,Retinol Anti-Aging Serum,The INKEY List,12.99
575,6809316515,5,1.0,,0,0,0,2020-02-27,"I love this product, it’s wonderful. Leaves my skin so soft and silky. Helps with the wrinkles with regular use.",Retinol Anti-Aging Serum,lightMedium,brown,combination,brown,P443842,Retinol Anti-Aging Serum,The INKEY List,12.99
576,1331527601,5,1.0,,0,0,0,2020-02-27,I really enjoyed this product! It’s nice to have an inexpensive way to customize my skincare routine. It went on smooth and didn’t have any weird scent which is always a plus :),Go get this product!,mediumTan,hazel,combination,brown,P443842,Retinol Anti-Aging Serum,The INKEY List,12.99
577,6621311100,5,1.0,,0,0,0,2020-02-27,The Inkey List Retinol Anti-Aging Serum is simple to use and gets awesome results!  I was sent a sample free to test and I was surprised at my results.  I could see a noticeable difference in my fine lines shortly after starting to use it.  Give it a try I recommend it!,I recommend it!,light,green,dry,blonde,P443842,Retinol Anti-Aging Serum,The INKEY List,12.99
578,5072628260,4,1.0,,0,0,0,2020-02-27,Leaves your skin feeling smooth.  I am fair skin and have not had any problems with any redness or sensitivity from the product.  Fine lines have softened after 3 weeks of applying at bedtime.,,fair,blue,combination,brown,P443842,Retinol Anti-Aging Serum,The INKEY List,12.99
579,5182369607,4,0.0,0.0,1,1,0,2020-02-27,"I don’t really have any complaints, but I probably won’t purchase again since I didn’t see much of a difference in my skin.",Nice product,fairLight,brown,dry,brown,P443842,Retinol Anti-Aging Serum,The INKEY List,12.99
580,2192365131,4,1.0,1.0,1,0,1,2020-02-27,"This product is affordable, and it’s a great product minimize wrinkles and pores. I would recommend this product if you are starting out with skincare.",,deep,brown,dry,black,P443842,Retinol Anti-Aging Serum,The INKEY List,12.99
581,24798112199,5,1.0,,0,0,0,2020-02-26,My skin feels so nice after applying this. Love it,Love my skin,lightMedium,blue,combination,brown,P443842,Retinol Anti-Aging Serum,The INKEY List,12.99
582,25325704941,5,1.0,0.0,1,1,0,2020-02-26,I definitely have no complaints about this product. This is my first time using it and it’s a great product. My skin looks nice and soft and healthy that’s just what I was looking for in a new cream and I’m glad I had the opportunity to try it.,Wonderful Product,light,hazel,combination,brown,P443842,Retinol Anti-Aging Serum,The INKEY List,12.99
583,9894453783,5,1.0,0.0,1,1,0,2020-02-24,"I love everything about this except that I wish you could buy it in larger quantities! It is a little bit runny, but it is also very spreadable. The tube packaging can allow it to run out too fast if you are not expecting it, but once you know what the consistency is like it is totally fine.",My absolute favorite serum,fairLight,brown,combination,red,P443842,Retinol Anti-Aging Serum,The INKEY List,12.99
584,5971537113,4,1.0,,0,0,0,2020-02-24,I love this product. My skin looks brighter and smoother. A little goes a long way and no irritation on my sensitive skin.,,fair,blue,combination,blonde,P443842,Retinol Anti-Aging Serum,The INKEY List,12.99
585,1075020242,5,1.0,1.0,9,0,9,2020-02-22,I received The Inkey Retinol Serum as a free sample. I love the serum because it has a light scent and it absorbs very smooth on my face . There are no irritation. I really love Inkey Retinol Serum!,,deep,brown,combination,black,P443842,Retinol Anti-Aging Serum,The INKEY List,12.99
586,1113342166,5,1.0,1.0,11,0,11,2020-02-22,Can’t complain about this product! Price point is amazing. A little goes a long way. I’m all about that preventive treatment. But see how brighter and smoother my skin looks.,great price point,medium,brown,combination,black,P443842,Retinol Anti-Aging Serum,The INKEY List,12.99
587,6049023257,4,1.0,0.8333330154418945,6,1,5,2020-02-21,"I got this product a free sample “THE iNKEY LIST“ from PICHME. First impression in packaging: very simple black and white. I thought it was some kind of medicine. Very plain design. I opened it and color of serum is pale yellow, white. Smell light, pleasant smell- no overwhelming scent. The serum is easy to apply and smooth and does absorb nicely. No irritation and went well with my moisturizer. Overall it is good product.",nice product,lightMedium,brown,combination,auburn,P443842,Retinol Anti-Aging Serum,The INKEY List,12.99
588,11052580657,4,1.0,1.0,5,0,5,2020-02-21,"The lady at a ’The Inkey List’ event recommended this to me, along with the BHA and rose hip oil. I love these products. they are affordable yet effective. My skin is definitely smoother and brighter since using the retinol and I’ve noticed that the darker half of my face has evened out more. Mind you, it’s a slow process and you have to be consistent and only use it at night.... and y’all... I actually need a new bottle lol",Hyperpigmentation be gone! Great skincare product,deep,brown,oily,black,P443842,Retinol Anti-Aging Serum,The INKEY List,12.99
589,1322015882,4,1.0,0.75,8,2,6,2020-02-21,"Nice texture, and no overwhelming perfume-y scent!  The serum applied smoothly with no pilling and absorbed quickly.  I had no irritation and the product played well with exfoliators and moisturizers.",,fair,blue,combination,red,P443842,Retinol Anti-Aging Serum,The INKEY List,12.99
590,1167715831,4,1.0,1.0,3,0,3,2020-02-21,The Inkey List retinol serum is a very nice product. It has a pleasant scent and a good texture. This serum leaves my feeling smooth and moisturized.  I’ve been using it 2-3 times per week to make sure it agrees with my skin. There hasn’t been any negative reaction and my skin looks healthy and radiant. I will continue to use this product as long as it keeps my skin looking good. The price point for this line is great as well.,,fair,hazel,oily,brown,P443842,Retinol Anti-Aging Serum,The INKEY List,12.99
591,25273117227,4,1.0,1.0,1,0,1,2020-02-20,"i’m always interested in trying any and all anti-aging products, especially retinol. i haven’t been using this product very long so i can’t give a full review. i do like the fact that it didn’t irritate my skin. i’m not one to use several products on my face at once. i keep it simple. i use it in the morning and before bedtime. it makes my skin look radiant and hydrated. i will continue to use this product and i’m excited to see the end results.",,deep,brown,normal,red,P443842,Retinol Anti-Aging Serum,The INKEY List,12.99
592,8012325434,5,1.0,0.0,1,1,0,2020-02-20,This serum is really moisturizing. A little goes a long way and has a light pleasant scent. My skin feels amazing!,A little goes a long way!,deep,brown,combination,brown,P443842,Retinol Anti-Aging Serum,The INKEY List,12.99
593,8613026140,5,1.0,1.0,1,0,1,2020-02-20,Great product and Price! I was very pleased with this retinol. It really brings my skin back to life - I’ve already bought another one!,Great product and price!,lightMedium,brown,oily,brown,P443842,Retinol Anti-Aging Serum,The INKEY List,12.99
594,1709138293,5,1.0,0.8888890147209167,9,1,8,2020-02-20,"I’m not sure what I was expecting when I tried this, but whatever it was, I’m happy. I have been using this for over a month and my skin is soft, glowing, and looks clearer and younger.  I don’t have the dry spots I normally get in the cold weather, and my skin has a healthy glow with less crow’s feet and discolouration.   I love that my eyes look brighter because my skin looks better.  This was like a pep talk for my entire face and I will continue to use it.",Love it!,lightMedium,brown,combination,black,P443842,Retinol Anti-Aging Serum,The INKEY List,12.99
595,4279227,5,1.0,,0,0,0,2020-02-20,Great product with fantastic results! Highly recommend!,,lightMedium,brown,combination,brown,P443842,Retinol Anti-Aging Serum,The INKEY List,12.99
596,5408524925,5,1.0,,0,0,0,2020-02-19,Love this product ever since using I can see less wrinkles and fine lines my skin is glowing I use it morning and night it is definitely staying in my skin care routine definitely recommend,Love it,lightMedium,brown,normal,brown,P443842,Retinol Anti-Aging Serum,The INKEY List,12.99
597,2494663684,4,1.0,,0,0,0,2020-02-19,I like this! Works great and no annoying smell. And non drying,,lightMedium,hazel,combination,blonde,P443842,Retinol Anti-Aging Serum,The INKEY List,12.99
598,909415987,4,1.0,,0,0,0,2020-02-19,I was extremely surprised how well this works for the price! It did not irritate my skin at all. Goes on smooth and no bad scent. I will purchase another bottle!!!,this is awesome!,lightMedium,brown,normal,brown,P443842,Retinol Anti-Aging Serum,The INKEY List,12.99
599,8479407247,4,1.0,,0,0,0,2020-02-19,It goes on smoothly and sinks into the skin nicely without leaving a thick layer on the skin and i  love how it makes my face look smooth. Excellent product at very reasonable price,great product for a great price,medium,brown,combination,black,P443842,Retinol Anti-Aging Serum,The INKEY List,12.99
600,1162371483,4,1.0,,0,0,0,2020-02-19,smooth cream made my face feel fresh  and not irritated at an affordable cost,renewed,light,brown,normal,brown,P443842,Retinol Anti-Aging Serum,The INKEY List,12.99
601,6306976934,5,1.0,,0,0,0,2020-02-19,I got this as a free sample from pinchme. The quality is good for the price. I did like it and I’d probably buy it again. Would like to see what a full routine of inkey products would do and that’s exactly what I’m going to try.,,medium,brown,dry,black,P443842,Retinol Anti-Aging Serum,The INKEY List,12.99
602,1600042102,5,1.0,1.0,2,0,2,2020-02-19,The Inkey List Retinol Anti-Aging Serum is so good! I love the lightweight gel consistency. It soaks in with no residue. I can not believe what a great price it is for how well it works with no irritation. I started with only every other day application at first just to make sure. I will continue to use to see even more improvements in my lines.,I’ll take more please!,light,blue,oily,auburn,P443842,Retinol Anti-Aging Serum,The INKEY List,12.99
603,7523220377,5,1.0,1.0,2,0,2,2020-02-19,Loved the smooth velvety texture and how fast it absorbed into my skin. Very light and after a few weeks of use the results were visible and my skin was smoother.,Recommend!,lightMedium,brown,combination,brown,P443842,Retinol Anti-Aging Serum,The INKEY List,12.99
604,25265378424,5,1.0,1.0,2,0,2,2020-02-19,"I have been wanting to try a Retinol cream for a while and was scared to take the leap now i wish I hadn’t waited so long! Goes on easily and did not leave my skin feeling or looking greasy, huge plus! My skin has ben looking smoother and more even so I have to say I’m a huge fan!",LOVE it!,light,brown,combination,blonde,P443842,Retinol Anti-Aging Serum,The INKEY List,12.99
605,2001883316,4,1.0,1.0,1,0,1,2020-02-19,"Smooth, creamy, and melts into my skin quickly. Doesn’t sting like another product I’d tried, and I like that it dries fast enough to get my moisturizer on soon after.",,fair,blue,dry,brown,P443842,Retinol Anti-Aging Serum,The INKEY List,12.99
606,5064704421,5,1.0,1.0,1,0,1,2020-02-19,Provided a light moisture on my skin which was comfortable.,,light,blue,dry,blonde,P443842,Retinol Anti-Aging Serum,The INKEY List,12.99
607,6263977109,5,1.0,1.0,1,0,1,2020-02-19,"I really am enjoying this retinol serum, I have sensitive skin and it did not cause any irritation, it’s a very light gel consistency and it absorbs quickly into the skin. I use it every night before my moisturizer and every morning I wake up and I see a difference in my skin, it has helped a lot with some fine lines and some discoloration",I like it,lightMedium,hazel,combination,brown,P443842,Retinol Anti-Aging Serum,The INKEY List,12.99
608,7962624448,5,1.0,0.5,2,1,1,2020-02-19,I’ve never tried a retinol product before and was eager to give it a try.  The first few times I tried it I broke out like crazy and thought this isn’t for me but I heard in a video that your skin purges. So I kept applying it a little at a time and the breakouts stopped my skin looks healthier and I’m seeing some lightening in an area of concern. All in all a really good product. Quickly absorbs into your skin doesn’t have a scent. Plus it’s a quarter of the price of other products like this and a little goes a long way.,surprise,light,hazel,oily,brown,P443842,Retinol Anti-Aging Serum,The INKEY List,12.99
609,6262084931,3,0.0,0.5,2,1,1,2020-02-19,"I used this product for a few weeks and didn’t notice any difference in my skin. The retinol also dried my skin out more than normal (the winter weather probably made it worse), so keeping my skin moisturized was a struggle. This product is probably better for someone with older skin and more wrinkles.",,light,blue,combination,brown,P443842,Retinol Anti-Aging Serum,The INKEY List,12.99
610,71374259,5,1.0,0.0,1,1,0,2020-02-19,I’m giving this a 5 star as it has not irritated my skin but I do notice increased smoothness,,light,green,combination,brown,P443842,Retinol Anti-Aging Serum,The INKEY List,12.99
611,1948596743,5,1.0,1.0,1,0,1,2020-02-18,"This is a great product, especially for the price! Retinol is so good at smoothibg everything and this product delivers.  I highly recommend this, if you are toying with the idea of adding rentinol to your routine, you have no excuse. Love this!",Can't get better results for the price!,fair,hazel,combination,brown,P443842,Retinol Anti-Aging Serum,The INKEY List,12.99
612,9079552305,1,0.0,0.2857140004634857,63,45,18,2020-02-18,My goal was to remove dark marks in the simplest way possible i wouldn’t recommend if you don’t have time to use other products like sunscreen every day don’t buy .,Wasn’t what I was looking for,tan,brown,combination,black,P443842,Retinol Anti-Aging Serum,The INKEY List,12.99
613,25248834064,5,1.0,,0,0,0,2020-02-17,"Wow!!! What a great product!!! It’s doing wonders for me, I Love it!!",,fair,blue,combination,brown,P443842,Retinol Anti-Aging Serum,The INKEY List,12.99
614,24843621730,5,1.0,1.0,1,0,1,2020-02-17,Favorite retinol serum ever! Remember retinol is very effective so build your way up I use mine every other night. I noticed significantly improved skin texture with my blemished being significantly lessened. It’s not sticky and has a nice texture. Great anti-aging treatment. Highly recommend!,Great anti-aging treatment!,light,blue,dry,blonde,P443842,Retinol Anti-Aging Serum,The INKEY List,12.99
615,10323247915,5,1.0,,0,0,0,2020-02-17,I’m very impressed with this product. It is very easy to apply and I can feel it working almost immediately. It leaves my skin feeling smooth and after a few days of use made my skin tone more even. I’m very impressed and the price is so good compared to other retinol products. I highly recommend this. It’s very easy to work into your daily routine and has quick and effective results. What more could you ask for? I love it!,Excellent value and works very well!,fair,brown,normal,black,P443842,Retinol Anti-Aging Serum,The INKEY List,12.99
616,21137925649,5,1.0,0.3333329856395721,3,2,1,2020-02-17,I enjoy the benefits of using the inkey list retinol. It makes my skin look renewed and so healthy and glowing.,,fair,blue,dry,brown,P443842,Retinol Anti-Aging Serum,The INKEY List,12.99
617,24624727494,5,1.0,1.0,4,0,4,2020-02-16,"I really liked this product, the price is amazing and got better results than some of the high priced Retinol creams I’ve used. I could tell a difference in my skin after the first several applications, clearer, softer skin and more even toned. I was able to use every night with no problems, no redness or irritation at all but could see results for sure. Will definitely purchase this again!",Winner,fair,blue,dry,blonde,P443842,Retinol Anti-Aging Serum,The INKEY List,12.99
618,8032947592,5,1.0,1.0,1,0,1,2020-02-16,"i love this stuff. i apply this at night and the next morning, my skin is so smooth. it does help with my dark spots, which are acnce scars, especially if i use them soon after the scar as formed. definitely recommend if you’re looking for something to help with dark spots and skin smoothness.",,mediumTan,brown,normal,brown,P443842,Retinol Anti-Aging Serum,The INKEY List,12.99
