Unnamed: 0,author_id,rating,is_recommended,helpfulness,total_feedback_count,total_neg_feedback_count,total_pos_feedback_count,submission_time,review_text,review_title,skin_tone,eye_color,skin_type,hair_color,product_id,product_name,brand_name,price_usd
808,2181550789,5,1.0,,0,0,0,2020-01-21,"Love this product! The texture was great, smooth, silky, and felt really light on my skin. The results have been amazing. I feel like my skin is brighter and the noticeable wrinkles i have are way softer and not as deep. I love putting it on at night and waking up to beautiful soft skin. I will definitely be buying this again. Inkey makes amazing products",,light,green,normal,blonde,P443842,Retinol Anti-Aging Serum,The INKEY List,12.99
809,8102422019,4,1.0,0.0,2,2,0,2020-01-21,I tried Inkey Retinol Serum and I really liked it. It goes on easily and absorbs well. I noticed that my skin was softer after using a few days. It did have a slight smell but it wasn’t overpowering. Overall I liked it and would definitely recommend it.,Inkey Retinol,fair,brown,combination,brown,P443842,Retinol Anti-Aging Serum,The INKEY List,12.99
810,8432890413,5,1.0,,0,0,0,2020-01-21,"I’m impressed with this. I’ve been using it for a few weeks and have seen some improvement in my fine lines. I had no trouble with redness or any kind of reaction, which I have gotten using retinols in the past. Plus the price is outstanding.",Great product for the price!,light,brown,dry,brown,P443842,Retinol Anti-Aging Serum,The INKEY List,12.99
811,1060944024,4,1.0,,0,0,0,2020-01-21,I liked how the Inkey List Retinol Anti Aging Serum felt on my skin. I liked the mild scent and the way my skin looked. I will definitely  continue to use this product.,Great,light,hazel,combination,brown,P443842,Retinol Anti-Aging Serum,The INKEY List,12.99
812,5335791837,5,1.0,,0,0,0,2020-01-21,I’ve been using this serum every other night. I’ve noticed that on the nights I use it my skin feels very hydrated and smooth the next day.,Retinol Anti-Aging Serum,light,brown,dry,brown,P443842,Retinol Anti-Aging Serum,The INKEY List,12.99
813,6217080931,5,1.0,0.0,1,1,0,2020-01-20,"Just purchased a second tube of this product.  I’m not sure it did much for fine wrinkles, but I feel like my skin is more even toned and brighter.",Just purchased again - highly recommend,lightMedium,blue,combination,brown,P443842,Retinol Anti-Aging Serum,The INKEY List,12.99
814,23082703123,5,1.0,0.6000000238418579,5,2,3,2020-01-20,"This product is very nice. I received this as a product to try from PinchMe, and it made my skin look and feel so good. It isn’t greasy and it doesn’t make my skin appear shiny like most serums do on the face.",Love this!,deep,brown,combination,black,P443842,Retinol Anti-Aging Serum,The INKEY List,12.99
815,5716458545,5,1.0,,0,0,0,2020-01-20,"I love this retinol!! I love how it smells, and how a little goes along way. I’ve been using as directed for about two weeks now, I haven’t seen any big change yet. However I will continue to use because I love how it feels on my skin.",Its the best!,light,brown,combination,blonde,P443842,Retinol Anti-Aging Serum,The INKEY List,12.99
816,21018183713,4,1.0,,0,0,0,2020-01-20,It definitely makes me skin feel better but I didn’t notice much of a difference with the fine lines around my eyes.,,light,brown,combination,brown,P443842,Retinol Anti-Aging Serum,The INKEY List,12.99
817,8384212404,5,1.0,,0,0,0,2020-01-20,"Retinol Anti aging serum is must have in your routine, no matter the age it’s always a good idea to use if combating wrinkles and fine lines is a must. The reason I was very pleased with using this product is because it’s got very clean ingredients and free of harsh chemicals. Thank you!",Clean ingredients,lightMedium,blue,oily,blonde,P443842,Retinol Anti-Aging Serum,The INKEY List,12.99
818,7456293198,5,1.0,,0,0,0,2020-01-20,I’m not too thrilled about the smell but I do feel like this serum leaves my skin moisturized and when I wake up my skin isn’t dry at all. This is my first time using a serum but it definitely won’t be my last. I’m hoping in days to follow for me to notice more things like a brighter face and fresher look.,Great product,tan,brown,combination,black,P443842,Retinol Anti-Aging Serum,The INKEY List,12.99
819,22184771028,4,1.0,,0,0,0,2020-01-19,This left my skin soft and smooth.  Had some redness after the first new uses.,Love It!,light,green,combination,brown,P443842,Retinol Anti-Aging Serum,The INKEY List,12.99
820,7385206316,4,1.0,1.0,2,0,2,2020-01-19,"The first night I used this serum, I wasn’t too thrilled with it because of the scent. It smelled like an old, expired lotion or makeup..which is why I couldn’t give it 5 stars. But the next morning my face was so smooth that I decided to continue using it. After about a week, aside from my skin being extremely soft, I noticed that my face looked brighter and had a healthy glow. I didn’t expect to see that much of a difference, but I definitely do. So aside from the nasty smell, this serum is a keeper.",Smooth skin,fair,green,combination,blonde,P443842,Retinol Anti-Aging Serum,The INKEY List,12.99
821,1245272287,4,1.0,0.25,4,3,1,2020-01-19,"I having been using this product for a few weeks now and have been enjoying how it’s been working to minimize my fine lines. I love how easy it is to blend into my skin and it doesn’t leave it sticky like other retinol serums I have tried. The tube gave a nice control to squeeze out how much or how little you need, which I really appreciated so I don’t waste any. I am looking forward to seeing the results after using this product for a while longer to if my fine lines get even less noticeable. I think the Inkey List is a nice affordable product with high quality ingredients, my only downfall is I didn’t see as quick or obvious results from using it like I have with other retinol products. Altogether I still would recommend this product for it’s price point and high quality ingredients.",Nice quality anti-aging serum.,light,blue,combination,blonde,P443842,Retinol Anti-Aging Serum,The INKEY List,12.99
822,12708751690,5,1.0,,0,0,0,2020-01-19,If I wouldn’t have bought this myself I would swear that it is a really expensive serum. I have seen results with this more than any other retinol I have tried. I recently have tried about 6 different brands trying to find my every day forever retinol and it came down to this and the Drunk Elephant. After several weeks of continuous use of both (not at the same time of course) this one is the one that won my heart... and I promise it’s not cause the price either. During my time on this I received numerous compliments on this but didn’t need to hear it from others cause it was obvious every time I looked in the mirror. The Drunk Elephant is good but in my opinion not as good as this.I will be seeing a dermatologist soon to get a script for Retin A bit will continue to purchase and use this on the Retin A off days!,WOW,lightMedium,brown,dry,brown,P443842,Retinol Anti-Aging Serum,The INKEY List,12.99
823,2091352431,5,1.0,0.0,1,1,0,2020-01-19,This is my first product from inkey list and definitely won’t be the last! This retinol works on my skin without stripping it. It contains squalane and adds moisture.  A little goes a long way so this will last a while.  Also you can’t beat the price.,Great retinol product,light,brown,combination,black,P443842,Retinol Anti-Aging Serum,The INKEY List,12.99
824,1594366454,5,1.0,1.0,3,0,3,2020-01-18,"I’ve  been using The Inkey List Retinol for a couple weeks now. It works just as well as other Retinol products I’ve used but at a much better price point. It doesn’t have much of a smell, which I like. I’m going to check out some of their other products as well.",Great product. Great price!,light,brown,combination,brown,P443842,Retinol Anti-Aging Serum,The INKEY List,12.99
825,1299661597,1,0.0,0.3157890141010284,19,13,6,2020-01-18,After using The Inkey List Retinol for two weeks at night I didn’t notice any difference if my skin. I didn’t have a bad experience just no results at all.  It’s such a great price I was hoping it would work.,Wanted to love it,light,brown,normal,brown,P443842,Retinol Anti-Aging Serum,The INKEY List,12.99
826,21291246463,4,1.0,,0,0,0,2020-01-18,I have been using this product for few weeks and so far I like it. I use it in conjunction with another moisturizer of my choice. It made my skin look clear. The only thing I didn’t like about it is it has strong smell that I have to mask it with the scent of my moisturizer. It absorbs on my skin fast and doesn’t leave residue.,Good product,lightMedium,brown,dry,brown,P443842,Retinol Anti-Aging Serum,The INKEY List,12.99
827,1489958229,5,1.0,,0,0,0,2020-01-18,"I’ve been using this product in addition to an essence and my usual Clinique acne solutions 3 step routine, and I haven’t had any problems. I was using a serum before that seemed to clog my pores and cause breakouts, but I don’t have that with this product. It’s very lightweight and is not heavily fragranced. I don’t have any wrinkles, so I’m using to prevent them. So far it’s been very good to my skin.",,tan,brown,oily,brown,P443842,Retinol Anti-Aging Serum,The INKEY List,12.99
828,22979593162,5,1.0,0.0,2,2,0,2020-01-18,"This is a very nice product and I have noticed a difference since I’ve been using it. I use it before bed and in the morning I see a better me. You don’t have to use very much, which is great, and it absorbs wonderfully. It feels nice on my face, very light feeling and no greasy or sticky residue. I very highly recommend.",Very satisfied,fair,blue,combination,brown,P443842,Retinol Anti-Aging Serum,The INKEY List,12.99
829,1550672318,5,1.0,,0,0,0,2020-01-17,"Very nice product for anti-aging. I received this product complimentary to test. I enjoyed the consistency and the retinol didn’t make my skin burn like other similar products. It didn’t smell bad or leave any weird skin cast. It absorbed immediately in my skin. When I finish the tube, I will buy it. Glad I was offered the opportunity by pinch me and Sephora.",,fair,hazel,combination,brown,P443842,Retinol Anti-Aging Serum,The INKEY List,12.99
830,2541155694,3,1.0,,0,0,0,2020-01-17,Price point is definitely way better than other products but haven’t really noticed a difference. I doesn’t dry out my skin and I have only been using it a couple weeks so it is probably to early to see results.,,fair,brown,dry,black,P443842,Retinol Anti-Aging Serum,The INKEY List,12.99
831,24944271644,4,1.0,,0,0,0,2020-01-17,I received a free sample size of this from pinch me. I liked it but I’m not sure if I can tell any differences yet.,,light,hazel,combination,brown,P443842,Retinol Anti-Aging Serum,The INKEY List,12.99
832,11518989027,5,1.0,,0,0,0,2020-01-17,"This product goes on well, has clean ingredients and comes at a great price. So far I’m super impressed with the value!",Love that this product is clean!,fair,blue,combination,blonde,P443842,Retinol Anti-Aging Serum,The INKEY List,12.99
833,11487460797,5,1.0,,0,0,0,2020-01-17,This works for me next day my face is brighter dark circles are lighter even my skin tone. As far as burning it just tingled the first time,retinol,lightMedium,brown,combination,black,P443842,Retinol Anti-Aging Serum,The INKEY List,12.99
834,9292373575,1,0.0,0.684211015701294,19,6,13,2020-01-16,"I received a free sample of the Inkey List Retinol Anti-Aging serum to try.  Unfortunately I did not care for this product.   The smell was not very appealing, it left my skin feeling tacky after it was applied.  I also began to experience an increase in acne after using the product.  I have balanced to dry skin normally, without occurrences of acne.  Perhaps this product would work better on other individuals.",Didn't care for the product,light,hazel,normal,brown,P443842,Retinol Anti-Aging Serum,The INKEY List,12.99
835,1380537425,5,1.0,,0,0,0,2020-01-16,"I received a deluxe sample of this and must say it’s fantastic ! I already purchased the product. It wgoes o orks slowly but is reducing some of my fine lines and well as my wrinkles. The serum on nicely and unlike other serums I have tried, I received no irritation.I apply it at night then my evening moisturizer. It leave my skin soft, and makes applying makeup in the am a breeze.It’s also cruelty free which is important to me.",LOVE IT !,lightMedium,hazel,combination,brown,P443842,Retinol Anti-Aging Serum,The INKEY List,12.99
836,2862476959,5,1.0,,0,0,0,2020-01-16,The Inkey List’s Retinol Anti-Aging Serum has been a fun addition to my skincare routine. It’s a quick and easy step to help my skin look it’s best. There isn’t a scent which is nice when layering it with other scented products. This serum absorbs quickly into my skin.,A new staple in my skincare routine,fair,hazel,combination,brown,P443842,Retinol Anti-Aging Serum,The INKEY List,12.99
837,1552438337,4,1.0,,0,0,0,2020-01-16,"The Inkey List retinol is my first experience with using retinol in about a year. I have combo agin skin that gets very red in the winter time. After using the serum every other night I noticed a different in the texture of my skin and it felt much “tighter.” This took a bit to get used to, because my skin felt incredibly dry/tight until I started using a high quality moisturizer with it. The combo made a big difference in the overall appearance of my skin. It DID burn the first week or so I used it... not horribly but enough to take note. It also made my skin more red but faded after an hour or two. Overall I would say this is a great product, esp for the price!",Works well with a high end moisturizer,fair,brown,combination,brown,P443842,Retinol Anti-Aging Serum,The INKEY List,12.99
838,5424827398,5,1.0,0.0,1,1,0,2020-01-16,I loved this “TheInkeyList“ serum.  I used it and it made my skin feel nice and smooth.  I have combination skin and it would perfectly.,Inkey Serum,light,brown,combination,brown,P443842,Retinol Anti-Aging Serum,The INKEY List,12.99
839,9420863852,5,1.0,,0,0,0,2020-01-16,"Very nice serum, it leaves your skin feeling soft and it doesn’t have a strong smell which I really like. Great product for a fair price.",Nice Retinol Serum,light,brown,normal,auburn,P443842,Retinol Anti-Aging Serum,The INKEY List,12.99
840,978767747,5,1.0,,0,0,0,2020-01-16,I have seen excellent results using this serum for the last 3 weeks!!  It has really helped smooth out my fine lines and improve the texture of my skin in such a short time.  I didn’t experience any skin irritation and that is a huge plus!  This is such an amazing value for a Retinol serum and I have found my new favorite!  I highly recommend it!!,Best Retinol Serum I've Tried!!,light,brown,dry,brown,P443842,Retinol Anti-Aging Serum,The INKEY List,12.99
841,2805132966,5,1.0,1.0,2,0,2,2020-01-15,I’m liking this very much so far. I use it on alternate nights with my retin A.  It is not irritating.,,fair,blue,dry,brown,P443842,Retinol Anti-Aging Serum,The INKEY List,12.99
842,1964114711,5,1.0,,0,0,0,2020-01-15,I received this as a free sample and I have to say I love it and will be purchasing it soon. It really helped my skin.,Great product,lightMedium,brown,oily,blonde,P443842,Retinol Anti-Aging Serum,The INKEY List,12.99
843,1228608926,5,1.0,,0,0,0,2020-01-15,I liked the watery/ gel like texture of the product because it absorbs very well into my skin after serum. I used this along with my THE ORDINARY products and there is no irritation. I do use Retin-A so I honestly was not expecting this product to work at that same clinical level however I did sub this product for my Retin A every other day and the combo seems to be working very well. I have seen some nice tone correction and though I am in my thirties I do not have too many wrinkles but it does seem to be doing a good job of tightening with out the weightiness of the RetinA cream. I also like the smell.,light weightless gel,mediumTan,brown,oily,black,P443842,Retinol Anti-Aging Serum,The INKEY List,12.99
844,8564395237,5,1.0,,0,0,0,2020-01-15,Love this product! I put this on at night with a moisturizer and I’m seeing amazing results. My skin is brighter and the fine line are fading! I highly recommend this. Amazing price as well.,,lightMedium,green,normal,black,P443842,Retinol Anti-Aging Serum,The INKEY List,12.99
845,11755202066,5,1.0,,0,0,0,2020-01-15,This product is working great. This is same as prescribed retinol can’t believe it so reasonable. It may burn at beginning do skip days in between use.,Retinol works Great,fair,brown,dry,black,P443842,Retinol Anti-Aging Serum,The INKEY List,12.99
846,8383304173,5,1.0,0.5,2,1,1,2020-01-15,I have used this product for two weeks and have brighter skin and less fine lines around my eyes. Excellent results!,Excellent results,light,,combination,brown,P443842,Retinol Anti-Aging Serum,The INKEY List,12.99
847,1596941469,5,1.0,0.5,2,1,1,2020-01-15,"I absolutely love The Inkey List Retinol Anti-Aging Serum! It has a light consistency that goes on smoothly and absorbs quickly. It has no lingering scent, which is a great quality. I apply it to my face and neck before bedtime, and apply a light moisturizer over it. When I wake up in the morning, my face looks plumped, hydrated, alive, and dewy. It definitely gives my skin a healthy glow, and is keeping the visible aging at bay. The best part is, this very effective product costs less than $10! That is a steal for the amount of product you get, and how well the product works! I will continue to purchase this serum when I run out of my current tube, I just love it!",The Inkey List is on my list,fair,hazel,combination,brown,P443842,Retinol Anti-Aging Serum,The INKEY List,12.99
848,1259631848,5,1.0,,0,0,0,2020-01-15,Really love The Inkey Retinol Anti Aging Serum. I have only used it for a short time and can already see the difference. I will continue using. I received it as a sample and so happy that I did. I would highly recommend it to any looking for smoother skin. Works wonders.,Love the results.,lightMedium,brown,combination,auburn,P443842,Retinol Anti-Aging Serum,The INKEY List,12.99
849,23439167832,4,1.0,,0,0,0,2020-01-15,"The Inkey List work and it works well. I tested this product mainly on my forehead lines and I was impressed with how quick I saw results. My skin is much smoother now in that area. The only negative thing I have to say about this is the packaging, it lacks style but that does make it a little discreet and that might be a good thing if you don’t want anyone to know you have wrinkles and your treating them. Haha overall..I would purchase this.",Your wrinkles best friend,lightMedium,brown,combination,black,P443842,Retinol Anti-Aging Serum,The INKEY List,12.99
850,6497187738,5,1.0,1.0,1,0,1,2020-01-15,I love this product. I love the fact that it didn’t dry out my skin and I love the way my skin look and feel after using this product.,,deep,brown,combination,black,P443842,Retinol Anti-Aging Serum,The INKEY List,12.99
851,1198133796,3,0.0,,0,0,0,2020-01-15,"I’ve tried several retinol products in the past and usually within a few days I notice an improvement in my skin texture as it appears less congested and just more even. However, with this product I was a little disappointed. Maybe I need to give it more time but it leads me to believe that the retinol concentration is probably pretty low and I’d rather choose something a little more powerful. The smell is fine and it rubs in pretty well- a pea size is literally all you need so I’d imagine the tube would last a while.",I’ve used better products with retinol,lightMedium,blue,oily,brown,P443842,Retinol Anti-Aging Serum,The INKEY List,12.99
852,23535137265,5,1.0,,0,0,0,2020-01-14,I am surprised how well this worked for my skin. I am used to using retinol products and this felt like a super high quality serum. I was impressed with how much it brightened my skin seemingly overnight. It did not peel off or irritate my sensitive skin at all.,Soft and Glowing,fairLight,green,combination,blonde,P443842,Retinol Anti-Aging Serum,The INKEY List,12.99
853,1075947820,4,1.0,,0,0,0,2020-01-14,I found this product to be effective as a retinol but it was very strong for my skin. It said to apply it and then apply your moisturizer over it. I actually found the first time I used it for it to be too strong for my skin so I mixed a little in with my moisturizer and I found that to be effective. I think it’s a good product but just be aware that it might be too strong for sensitive skin.,,fairLight,brown,normal,gray,P443842,Retinol Anti-Aging Serum,The INKEY List,12.99
854,9257697668,5,1.0,,0,0,0,2020-01-14,"The Inky list Retinol Anti-aging serum is my new every night routine before summer. I have been using this serum only one week but I can see the difference. My sun spots are disappearing and in the morning my face is glowing- not oily, light. I would recommend to shake it before applying it is little bit watery. Sunscreen is must in the morning. My husband just started using it every night, my Sephora - Century city sold out. I’m going to oder it online.!!!! Love I!!!",,light,blue,combination,brown,P443842,Retinol Anti-Aging Serum,The INKEY List,12.99
855,24913317077,5,1.0,,0,0,0,2020-01-14,"I love this product! I have been using it every night for the past week and half, and the difference on my skin is amazing! My friends and family already noticed it. I don’t think I can live without this anymore! My skin feels and looks amazing! I have been recommending it to everyone.",Amazing product.,lightMedium,green,dry,brown,P443842,Retinol Anti-Aging Serum,The INKEY List,12.99
856,9231999265,5,1.0,,0,0,0,2020-01-14,Loved the way the product felt on my skin. Didn’t make my skin look to oily either. Will have to reupdate in a month to see if it made a difference,,lightMedium,hazel,normal,blonde,P443842,Retinol Anti-Aging Serum,The INKEY List,12.99
857,24395668658,5,1.0,,0,0,0,2020-01-14,I love the way this makes my skin feel. Its easy to apply and a little goes a long way. Highly recommend!,Retinol,fairLight,hazel,combination,blonde,P443842,Retinol Anti-Aging Serum,The INKEY List,12.99
858,1378742813,5,1.0,,0,0,0,2020-01-14,"InkeyLIST is unlike my typical retinol serum, it is a light-colored lotion-like substance that really spreads well and easy and safe to use on my face. It is very affordable and I highly recommend InKey as your first retinol serum.  I received this product as a free sample.",,light,blue,normal,blonde,P443842,Retinol Anti-Aging Serum,The INKEY List,12.99
859,2810605199,5,1.0,,0,0,0,2020-01-14,"This product is great for my skin, other retinol products have been too irritating but this one actually makes my skin feel moisturized and calm. It has a great serum smooth consistency and is easy to apply. It also has squalane and hyaluronic acid which eliminates the need for me to add these into my regime. I use this at night for best results.",Great For Irritated Skin,light,brown,combination,blonde,P443842,Retinol Anti-Aging Serum,The INKEY List,12.99
860,24912891867,5,1.0,1.0,2,0,2,2020-01-14,"I’m a busy mom of 3 in my early 40’s and I do not take care of my skin like I should. My skin care routine is non existent and I really need to change that. I used The Inkey List Retinol Anti-Aging Serum for the first time last week and could see a difference in my fine lines and wrinkles almost instantly. I do think that with prolonged use, that it could really help the overall appearance of my skin. I would recommend this product!",Great for fine lines and wrinkles,fair,blue,combination,red,P443842,Retinol Anti-Aging Serum,The INKEY List,12.99
861,6455641057,5,1.0,,0,0,0,2020-01-14,I love this anti-aging serum. My skin is smoother and my tone has evened out since using this product. It has helped with dark spots and improved my skin with less irritation. My skin looked dull before using this serum and now it looks radiant.,Great Serum!!,fairLight,brown,combination,brown,P443842,Retinol Anti-Aging Serum,The INKEY List,12.99
862,8012718170,5,1.0,,0,0,0,2020-01-14,I was honestly surprised by how much I liked this product.  It’s very hydrating and doesn’t dry out my skin or leave me peeling.  I use this on my neck and have no issues with sensitivity . I’m not sure of the long term effects but so far I like it.,Surprisingly good,light,blue,combination,brown,P443842,Retinol Anti-Aging Serum,The INKEY List,12.99
863,2849542217,4,1.0,,0,0,0,2020-01-14,"This seems like an amazing product. Although I haven’t been using it very long, about 2 weeks, I’m already seeing an improvement in my skin. It looks much better and it’s amazingly soft. It looks more youthful. I haven’t experienced any irritation or redness which is great. I will update in the future after using longer.",More youthful looking skin.,lightMedium,hazel,normal,blonde,P443842,Retinol Anti-Aging Serum,The INKEY List,12.99
864,7276401142,4,1.0,0.0,1,1,0,2020-01-14,"This is an excellent product to add to your beauty regimen! Usually when I read a bottle and it says use a very small amount I’m slept because it never seems to go as far as they think it might, this product though you truly only need a little bit for your whole face!It goes on smoothly, I at times have sensitive skin, but I felt no burning or discomfort, for myself almost a cooling effect. I began using it at night and in the morning for my makeup application, my skin did have a feeling of a more even tone. Perhaps a ‘happenstance’ I sometimes get slight breakouts on my jawline, and this seemed to help them disappear faster, not its intended use but it made me happier! For the price this product is WELL worth a try!",Treat Your Face!,fair,blue,combination,red,P443842,Retinol Anti-Aging Serum,The INKEY List,12.99
