Unnamed: 0,author_id,rating,is_recommended,helpfulness,total_feedback_count,total_neg_feedback_count,total_pos_feedback_count,submission_time,review_text,review_title,skin_tone,eye_color,skin_type,hair_color,product_id,product_name,brand_name,price_usd
288,11931447208,5,1.0,1.0,2,0,2,2021-03-17,Incredible! Retinol is the one topical ingredient that is proven in multiple dermatology studies to improve skin from the cellular level. I plan to use a retinol forever and have already seen an improvement in my skin texture and redness with this product. Great price and non-irritating formula.,Fantastic Retinol,fairLight,hazel,dry,brown,P443842,Retinol Anti-Aging Serum,The INKEY List,12.99
289,7186878966,5,1.0,0.9523810148239136,21,1,20,2021-03-17,"I’m shocked. This was recommended as a good “starter” retinol. I started using it every 3 nights OVER my moisturizer, then moved to every 3 nights under my moisturizer, and now can use it safely every other night. I experience some slight redness afterwards but by morning it’s gone and my skin is smooth. I do have rather sensitive skin though. I have been using it for over a month now and I’m SHOOOOOK. I can’t believe the difference. I’m 29, but have had a hysterectomy and my skin was aging so fast since then. This has helped fine lines, and my horrible texture and my breakouts. I’m always excited for retinol night! I will repurchase most definitely. Maybe after a couple bottles of this I will move to a stronger one, but this is an amazing starter!",In LOVE,light,green,dry,brown,P443842,Retinol Anti-Aging Serum,The INKEY List,12.99
290,24541959906,5,1.0,0.5458170175552368,251,114,137,2021-03-15,"I have to say I was a bit skeptical but I’ve heard great reviews about the inkey products oh, and I have to say that I’m blown away this is absolutely the best I have noticed a severe difference in my sun damaged skin, the brown spots on my face have lightened tremendously the lightweight therim is not too runny nor too thick so it’s soaks right into my skin. I am currently about to purchase more products from this brand.",not to thick not to runny .,light,green,combination,blonde,P443842,Retinol Anti-Aging Serum,The INKEY List,12.99
291,2216576958,4,1.0,1.0,7,0,7,2021-03-14,"This product has been my holy grail for a few months since I’m new to using retinol on a consistent basis. I have very reactive skin and while this did make me a little red, it wasn’t nearly what I thought it would be. It’s a great retinol to use if you’re just starting out on your retinol journey. I gave this four stars however, because I wish they had a higher percentage retinol product so I could stay with the brand. Even though I saw results, I’m still dealing with some deeper fine lines and want to increase the retinol percentage, so I unfortunately have to look for another product :(",Great Retinol for Beginners,light,hazel,combination,brown,P443842,Retinol Anti-Aging Serum,The INKEY List,12.99
292,1910814069,5,1.0,0.9230769872665404,13,1,12,2021-03-14,"I was using DE retinol for over a year and loved that. I wanted to save some money and not purchase DE products anymore, and this one is just the same if not better! The packaging is so much better and the retinol is super effective and great for my acne prone skin. Give it a try!",My new favorite retinol!,fair,green,dry,blonde,P443842,Retinol Anti-Aging Serum,The INKEY List,12.99
293,5773171253,5,1.0,,0,0,0,2021-03-13,This was my first retinol product i have tried and have loved it so far. I would recommend giving it a try and its affordable!,I would recommend,fair,hazel,normal,brown,P443842,Retinol Anti-Aging Serum,The INKEY List,12.99
294,7125378510,4,1.0,0.6666669845581055,6,2,4,2021-03-11,I’ve been using this for a few months and can’t really tell a difference in my skin aside from maybe slightly more even tone when I wake up in the morning after using it- but for the price it’s a good retinol to add to your routine!,,light,,combination,,P443842,Retinol Anti-Aging Serum,The INKEY List,12.99
295,10159046400,5,1.0,0.8333330154418945,12,2,10,2021-03-11,"I might be writing this review too soon but I’m so excited about this product. I used to use a very expensive retinol cream that I LOVED but it was nearly $100, I ran out of it recently and wanted to try something less expensive. For the price, this stuff is amazing. I had awful cystic acne around age 16-18 and it left bad scarring. Red marks. Indents. I’m 22 now and my skin is the best it’s looked since, but it has never gotten totally smooth and rid of red marks. After washing my face I use a neutrogena toner and apply this on top. I alternate between a regular moisturizer or the amazing water sleeping mask from laneige. I’ve only used this about 4 times so far in the last week and I see such a difference. My skin is so soft, smoother, and the red marks are brightening. Do yourself a favor and at least try this product.",holy grail,fair,green,dry,brown,P443842,Retinol Anti-Aging Serum,The INKEY List,12.99
296,10252151861,1,0.0,0.7142860293388367,21,6,15,2021-03-10,Saw the reviews raving about this one and decided to give it a try. I’ve been using this for months now and I haven’t noticed any changes. I was hoping this could help with my uneven skin tone and dark spots but mu skin looks the same.,Didn’t do anything for my skin,light,brown,oily,black,P443842,Retinol Anti-Aging Serum,The INKEY List,12.99
297,9812573332,5,1.0,1.0,5,0,5,2021-03-09,This a great beginner retinal product! It goes on really light to the skin and is absorbed quickly. The packaging does make it easy to apply too much product so you need to make sure you only use a really small amount. Great product for the price!,Good beginner product!,light,green,dry,red,P443842,Retinol Anti-Aging Serum,The INKEY List,12.99
298,5914387255,5,1.0,1.0,3,0,3,2021-03-09,"I was previously using the Sunday Riley A+ serum, which did make my skin smooth, but it smelled HORRIBLE. my fiancé hated the smell and I wanted to find the right retinol for my routine. This is definitely stronger and I am really starting to see a difference in the texture of my skin! I already have another tube added to my cart!",,light,brown,dry,brown,P443842,Retinol Anti-Aging Serum,The INKEY List,12.99
299,29983909310,5,1.0,1.0,5,0,5,2021-03-09,"I’m loving the results I’m seeing with this retinol! It takes 6-8 weeks to see results in a retinol serum and I can finally be confident without foundation! The only thing I don’t like is the packaging, I’d prefer to see this come in a pump form so I can be more precise with the amount I’m using.",Great retinol!,fair,hazel,dry,brown,P443842,Retinol Anti-Aging Serum,The INKEY List,12.99
300,28687278358,4,1.0,0.5555559992790222,9,4,5,2021-03-05,I like this retinol serum that everyone has been talking about it’s gentle and did not irritate my skin also I am broke so I need something affordable retinol I could use and great start for retinol but over I see myself repurchasing this for like maybe generation not sure if like strong retinol or weak retinol matters but this will do overall it’s great and affordable and start using this retinol because at age 25 that’s when aging starts to hit but the only thing I don’t like is still the packaging which is why I gave it a 4 star like why can’t Inkey list be simple to put serums in a glass bottle,,lightMedium,brown,normal,black,P443842,Retinol Anti-Aging Serum,The INKEY List,12.99
301,8242761937,5,1.0,0.857142984867096,7,1,6,2021-03-05,"I started using this as my first retinoid because it is more gentle and 1%. I noticed a difference in my chest and my face. I’ve been using it almost every night along with the eye cream, and following it with my other moisturizers and eye cream. I might bump it up to The Ordinary’s 2% when this is done though. I’m loving the reduction of spots and my pores look less visible",Great first retinoid,fair,green,dry,brown,P443842,Retinol Anti-Aging Serum,The INKEY List,12.99
302,7123235064,5,1.0,0.6666669845581055,12,4,8,2021-03-01,First time ever leaving a review! This product is worth it! You will see great changes in your skin if you’re consistent and patient.. LOVE LOVE LOVE this!,,deep,brown,combination,black,P443842,Retinol Anti-Aging Serum,The INKEY List,12.99
303,6337026250,1,0.0,0.4035089910030365,57,34,23,2021-03-01,"I’m surprised to see so many people rave about this product. I’ve been using 3 months and saw no results. I didn’t realize it was so ineffective until I then used a Sunday Riley retinol and immediately saw a difference in my skin. I think this serum may be very watered down, hence the price and lack of results. Higher dosages of retinol are more expensive so it makes sense. Personally, I recommend spending the extra dollars on other brands offered at Sephora, such as Sunday Riley.",Ineffective,mediumTan,hazel,normal,brown,P443842,Retinol Anti-Aging Serum,The INKEY List,12.99
304,28528938924,5,1.0,1.0,7,0,7,2021-02-27,I heard a lot of people have reactions when using a retinol for the first time but I had no issues with this one at all!,,light,brown,dry,black,P443842,Retinol Anti-Aging Serum,The INKEY List,12.99
305,7713860066,5,1.0,0.857142984867096,7,1,6,2021-02-27,was struggling with cystic acne and it completely changed my skin! LOVE it!,,fairLight,blue,combination,black,P443842,Retinol Anti-Aging Serum,The INKEY List,12.99
306,28390337994,5,1.0,0.7333329916000366,15,4,11,2021-02-24,Excelente producto bien ligero y fácil absorción lo recomiendo,,lightMedium,brown,oily,blonde,P443842,Retinol Anti-Aging Serum,The INKEY List,12.99
307,1552835275,4,1.0,0.3571430146694183,14,9,5,2021-02-19,Not sure that it works but have yet to move on from it because the price is great so think I’ll give it another bottle or two before I decide. It is small and goes fast.,Undecided,fair,brown,combination,brown,P443842,Retinol Anti-Aging Serum,The INKEY List,12.99
308,7558112438,5,1.0,0.8333330154418945,12,2,10,2021-02-17,this has helped me so much with my skin texture!!!!! it’s very gentle unlike some retinols but still has been super effective!!!! i highly recommend!!!,LOVE LOVE LOVE,light,green,oily,blonde,P443842,Retinol Anti-Aging Serum,The INKEY List,12.99
309,1725483321,5,1.0,0.8636360168457031,22,3,19,2021-02-16,"i love how my fave looks in the morning after i’ve used this. it is quite drying on my face, so i pair it with a really rich night cream/moisturizer & ceramide serum. i was always afraid of retinol for some reason, & thought this concentration might be too strong but i am now a believer! i started off 2x/wk nightly, & then 3x/wk. i might continue this regimen for a while since i use acids in between. would recommend!",,tan,brown,dry,black,P443842,Retinol Anti-Aging Serum,The INKEY List,12.99
310,6861264899,5,1.0,0.875,24,3,21,2021-02-15,Using in combo with Niacinamide & Squalane at night. Has done great work on my forehead expression line and shockingly my laugh lines. Skin is visibly plumper allaround and price is great.,Actually works!,fairLight,brown,combination,blonde,P443842,Retinol Anti-Aging Serum,The INKEY List,12.99
311,10263093062,5,1.0,0.8260869979858398,23,4,19,2021-02-15,"I really love this product. I’m new-ish to skincare. My fine lines around my eyes are getting worse (just turned 30) so I knew I wanted to incorporate a retinol into my routine but had no idea where to start. After reading some articles & watching some videos. I decided to try this as my introduction to retinol. I’m very pleased. I actually just had to cut my tube open last night to get the rest of the product out (there’s enough for maybe 4 more uses). But I definitely plan on getting another tube of this. But with my next bottle I plan on mixing it with a more powerful retinol. This was so soothing & didn’t cause any irritation that was implied with starting a retinol. I am very pleased. My skin is overall smoother & the fine lines are most definitely still there, I almost feel as though they’re not as visible?? Idk if that’s even possible but I like to think so. Lol",Will repurchase!,light,blue,combination,blonde,P443842,Retinol Anti-Aging Serum,The INKEY List,12.99
312,9969130961,5,1.0,0.6666669845581055,6,2,4,2021-02-15,This 100% works even my man who never notices anything noticed that a wrinkled that I have in the middle of my forehead that I always complain about is visibly gone Now he’s using it too,,light,brown,oily,black,P443842,Retinol Anti-Aging Serum,The INKEY List,12.99
313,27078119809,1,0.0,0.4324319958686828,37,21,16,2021-02-14,"I’m unsure what the type is about this product. It doesn’t work to replace your prescription grade Retinol in any sense. Though the main ingredients are the same 1% Retinol, it just simply doesn’t compare. Most of these products I enjoy, but this one does not do what a Retinol formula is supposed to do.",,lightMedium,brown,combination,brown,P443842,Retinol Anti-Aging Serum,The INKEY List,12.99
314,12484052399,4,1.0,1.0,9,0,9,2021-02-14,I was conflicted between the price and the reviews while deciding whether to buy this or not but I took a chance seeing the positive reviews. I have been using it every other night for a week and I have been pleasantly surprised. My skin already feels better and I have experienced no irritation. I had developed a darker patch on my cheek last year which has already started fading away. I would definitely recommend this to everyone!,Pleasantly surprised!,fair,hazel,dry,black,P443842,Retinol Anti-Aging Serum,The INKEY List,12.99
315,7693117072,5,1.0,1.0,3,0,3,2021-02-13,This is the perfect starter retinol. I use it every other night and haven’t experienced any irritation.,perfect started retinol,light,green,combination,brown,P443842,Retinol Anti-Aging Serum,The INKEY List,12.99
316,28092740841,5,1.0,1.0,4,0,4,2021-02-12,Helped with some of my acne scars and improved the texture of my skin.,,light,green,combination,blonde,P443842,Retinol Anti-Aging Serum,The INKEY List,12.99
317,1577369799,4,1.0,1.0,3,0,3,2021-02-12,This product really works my skin started peeling off after a week of using it and I could see results but I was also using the hydraulic acid,,mediumTan,brown,oily,brown,P443842,Retinol Anti-Aging Serum,The INKEY List,12.99
318,2247916450,5,1.0,0.5,2,1,1,2021-02-12,"I’m 30 with sensitive skin, I use this every night. This serum is affordable and actually works!",,lightMedium,brown,combination,brown,P443842,Retinol Anti-Aging Serum,The INKEY List,12.99
319,6155858825,1,0.0,0.9545450210571288,22,1,21,2021-02-11,"Given the rave reviews, I really wanted to like this retinol, but it totally trashed my skin.  I expected a purging period, but it never went away.  I had constant comedones, sebaceous filaments, and blackheads all over my forehead and cheeks while using.  It also does nothing to even any texture/hyperpigmentation.  If you’re looking for an affordable retinol, I would stick with The Ordinary.",There are better affordable retinols out there.,lightMedium,green,combination,blonde,P443842,Retinol Anti-Aging Serum,The INKEY List,12.99
320,8429310481,5,1.0,1.0,4,0,4,2021-02-10,I have used this retinol product for a week and gave me so much difference. I used all different brand’s expensive line for oily / combination/ acne skin but this one was good price and so much great result. I will buy more and will try other products as well.,recommend,fair,brown,combination,brown,P443842,Retinol Anti-Aging Serum,The INKEY List,12.99
321,10431386197,5,1.0,1.0,6,0,6,2021-02-09,officially turned 25 this year and was recommended to start using retinol lol. it’s very light on the skin but feels fresh. i’m happy with it,,mediumTan,brown,oily,brown,P443842,Retinol Anti-Aging Serum,The INKEY List,12.99
322,12722055296,5,1.0,0.8888890147209167,27,3,24,2021-02-08,"Nice, gentle retinol. Has helped with my dark under eye circles. Plus, Hyram approved!",,fair,green,combination,brown,P443842,Retinol Anti-Aging Serum,The INKEY List,12.99
323,5256000802,5,1.0,0.8999999761581421,10,1,9,2021-02-06,"I can’t say enough about this retinol, the texture of the serum is nice not sticky, it absorbs quickly, it’s my first retinol and it doesn’t irritate my skin. I wake up with my skin feeling so nice and clear. This definitely feels like a more expensive product. I use it at night and alternate with lactic acid and my skin is getting so smooth and clear and my makeup applies so much easier. This does not dry out my face.",add to your skin care routine.,fairLight,brown,combination,brown,P443842,Retinol Anti-Aging Serum,The INKEY List,12.99
324,1240310242,5,1.0,1.0,4,0,4,2021-02-06,"I love this serum. I use it every night on damp skin and my skin feels so soft in the morning. I haven’t seen any anti-aging effects yet, (I’m 32, just starting to see some faint lines) but I’ve only been using it for about four weeks. I’ve already purchased as second bottle even though I’m not even halfway through the first - my skin texture is the best it’s ever been!",,fairLight,brown,combination,brown,P443842,Retinol Anti-Aging Serum,The INKEY List,12.99
325,1620624620,5,1.0,0.8333330154418945,6,1,5,2021-02-05,"I was worried this would dry me out but it has been great! I use it every few nights, and it has helped my texture too!",,fair,brown,combination,blonde,P443842,Retinol Anti-Aging Serum,The INKEY List,12.99
326,25301982670,5,1.0,0.9090909957885742,22,2,20,2021-02-05,"Right before covid hit I had pretty much cleared up my skin, after wearing a mask for 8 hours a day over makeup (I work at Sephora so I usually have a full face on.) My skin has taken a toll. I have cystic acne (if you have acne that tends to normally sit under the skin and sometimes they never come to a head then you probably also have cystic acne.) My coworkers raved about this product so I decided to give it a try! At first it did make me break out but don’t be scared to try this because of that. Retinols are designed to push out the bad which is what we call “purging.” I have noticed a huge difference in my skin and my acne has gotten better since I’ve started using this. I had a cystic zit that has been on the side of my nose for about 6 months now and it refused to reduce in size and redness until I found this product. I was super insecure about it and it is finally almost gone. Please don’t be afraid to try this, you will break out at first but that means it’s working. Best retinol for the price!",if you have cystic acne you need this!,fair,brown,dry,brown,P443842,Retinol Anti-Aging Serum,The INKEY List,12.99
327,7921206788,5,1.0,0.8333330154418945,6,1,5,2021-02-04,I have been using this for the past month and have seen a difference in the texture and feel of my skin and the fine lines around my eyes have really diminished . Will not be runn8ng out of this!,What Lines?,lightMedium,green,normal,blonde,P443842,Retinol Anti-Aging Serum,The INKEY List,12.99
328,12078379081,2,0.0,0.8888890147209167,9,1,8,2021-02-01,"Really wanted to like this because the price is affordable but, I can’t help but compare it to the retinol from Sunday Riley. I only used this for a month so maybe I should’ve given it more time to work but with Sunday Riley even though I had a purging period, my face still felt hydrated and bright strangely? This was meh for me and I would rather spend extra on a retinol of better quality and get better results.",Meh,medium,brown,normal,black,P443842,Retinol Anti-Aging Serum,The INKEY List,12.99
329,22589242306,4,1.0,0.8333330154418945,12,2,10,2021-01-30,"I like this product but I do feel like the percentage of retinol is low. A little goes a long way and it only lasted me a month when using it every night. Didn’t see a difference in my acne spots but did help my acne heal faster. I would continue using this as a backup for when I can’t afford drunk elephant.  Oh yeah remember to put on sunscreen every morning because retinol thins out the skin and can cause sun damage. If you tend to have dry skin make sure when using it to watch how your skin reacts, retinol causes dryness.",It’s a yes for me,fairLight,hazel,combination,red,P443842,Retinol Anti-Aging Serum,The INKEY List,12.99
330,8479382929,1,0.0,0.5,6,3,3,2021-01-30,"did not do anything for me, I really wanted this to work but I did not see any change",doesn't work,fair,hazel,combination,brown,P443842,Retinol Anti-Aging Serum,The INKEY List,12.99
331,10484418183,5,1.0,1.0,5,0,5,2021-01-29,"I’m really obsessed with retinol and when I found this skincare line I was super excited. I have been using it about 2weeks and I have normal to dry skin , and I wake up with soft hydrated skin flawless lookin skin.my husband says my skin is always glowing !",,deep,brown,normal,black,P443842,Retinol Anti-Aging Serum,The INKEY List,12.99
332,9611277721,2,0.0,1.0,7,0,7,2021-01-28,I used this consistently every night until the bottle ran out and see no change. Good news is it’s a good price and it didn’t dry me out like other retinols.,No change but good price,light,hazel,dry,brown,P443842,Retinol Anti-Aging Serum,The INKEY List,12.99
333,9321132106,5,1.0,0.800000011920929,15,3,12,2021-01-28,I’ll be 30 in a month and I have already noticed some fine lines underneath my eyes and mouth. I bought different makeups to hide this but it was becoming more prominent. I started using this a week ago and my pictures already look like a have a filter one. My skin is smoother and my lines are waaaaay softer (some have disappeared already). I’m very happy,Change after the first use,light,hazel,combination,brown,P443842,Retinol Anti-Aging Serum,The INKEY List,12.99
334,6474305248,5,1.0,0.8333330154418945,6,1,5,2021-01-28,So far so good. I’ve been graduating my retinoids to retinols and after using it the .25% from first aid I decided to try this. I’m pleased so far no dramatic improvements yet but I’ll give it some time. Seems to be pretty light weight,Worth a try,lightMedium,blue,combination,brown,P443842,Retinol Anti-Aging Serum,The INKEY List,12.99
335,29451101752,4,1.0,0.75,4,1,3,2021-01-27,This is a really great retinol and it’s very cheap.,10/10,lightMedium,blue,combination,blonde,P443842,Retinol Anti-Aging Serum,The INKEY List,12.99
336,1328805396,5,1.0,0.8888890147209167,9,1,8,2021-01-25,"This works, not overnight but it gently does the job and keeps breakouts at bay while providing some skin brightening",Solid non scrip retinol,medium,brown,oily,brown,P443842,Retinol Anti-Aging Serum,The INKEY List,12.99
337,9108607239,5,1.0,0.9047620296478271,21,2,19,2021-01-24,I have very sensitive skin but I slowly worked up to using it every day. I’ve never had any irritation issues but I’ve seen a huge difference in my skin. I definitely recommend this product!,,lightMedium,blue,combination,brown,P443842,Retinol Anti-Aging Serum,The INKEY List,12.99
338,1896745264,5,0.0,0.8666669726371765,30,4,26,2021-01-23,This is NOT for people with Rosacea. I mistakenly read only the most recent reviews/good reviews. I put this on and immediately felt tingling and went on to read ALL the reviews. Luckily the one star reviews saved me from waking up tomorrow morning in despair. Do not use if you have Rosacea.,,medium,brown,normal,brown,P443842,Retinol Anti-Aging Serum,The INKEY List,12.99
339,10035216276,5,1.0,0.75,4,1,3,2021-01-21,noticed a visible difference after my first few uses! may need to move on to a stronger product now but really happy w my purchase and recommend,happy w it!,fair,hazel,dry,brown,P443842,Retinol Anti-Aging Serum,The INKEY List,12.99
340,7222074894,5,1.0,0.8823530077934265,17,2,15,2021-01-20,"For anyone wanting to start out on retinol, this is your guy!! I have aggressively normal skin but have recently been going through a dry patch bc of the winter season and this has given me 0 negative reactions. i’ve been using a pea sized amount every other night for ab 2 weeks and my skin tone has definitely evened, my forehead wrinkles seem less prominent and the overall health of my skin has improved dramatically - all with 0 irritation or drying. I noticed some slight purging within the first week but nothing too insane that i couldn’t take care of.. this retinol has been amazing for me and even works well w layering of other serums and products. definitely recommend.",AMAZING PRODUCT.,lightMedium,green,combination,brown,P443842,Retinol Anti-Aging Serum,The INKEY List,12.99
341,12822848196,5,1.0,0.625,8,3,5,2021-01-20,Love it... I like the texture and it really works.,it is a really good product ❤️✨,lightMedium,brown,combination,blonde,P443842,Retinol Anti-Aging Serum,The INKEY List,12.99
342,1334075989,4,1.0,0.9583330154418944,24,1,23,2021-01-19,"I’ve been using this every night for about 3 months. For reference I am 26 years old and very consistent with my skincare. I haven’t had any irritation or drying. It’s very gentle and doesn’t sting my rosacea.  Within a week, I saw amazing improvement in texture, and my acne scars have completely vanished by now. I love the consistency of the serum and you can’t beat this price for the quality. Minus one star only because I haven’t seen any difference in my sun spots. I’ve repurchased several times and will keep buying this! A game changer in my routine.",absolute staple & almost perfect,fair,hazel,combination,brown,P443842,Retinol Anti-Aging Serum,The INKEY List,12.99
343,8158167739,4,1.0,0.6000000238418579,5,2,3,2021-01-19,Makes my skin soft and brighter ; I think a smoother overall appearance.,,medium,brown,combination,brown,P443842,Retinol Anti-Aging Serum,The INKEY List,12.99
344,1508371178,5,1.0,1.0,5,0,5,2021-01-18,This product is great for early signs of aging. My skin is plumper and I’m seeing fine lines go away. Highly recommended!,,light,blue,combination,blonde,P443842,Retinol Anti-Aging Serum,The INKEY List,12.99
